{
  "schemaVersion": 2,
  "id": "knowledge.bulk-vs-row-actions",
  "kind": "Knowledge",
  "lifecycle": "active",
  "name": "Bulk versus Row Actions",
  "summary": "Choose action scope from the current selection rather than visual proximity to a table.",
  "selection": {
    "useWhen": [
      "distinguish multi-select action from row or global action"
    ],
    "avoidWhen": [
      "no list actions"
    ]
  },
  "relations": [],
  "requires": [],
  "content": {
    "decision": "Does the action target selected rows, one row, or the list itself?",
    "distinctions": [
      "Popconfirm confirms an action but does not define its scope"
    ],
    "forbidden": [
      "Bulk semantics for create, refresh, or single-row edit"
    ],
    "guidance": "Use a bulk action surface only when a non-empty multi-row selection is the explicit target.",
    "optional": [
      "Clear selection"
    ],
    "required": [
      "Visible action scope"
    ]
  }
}
