{
  "schemaVersion": 2,
  "id": "knowledge.filter-defaults",
  "kind": "Knowledge",
  "lifecycle": "active",
  "name": "Filter Defaults and Operators",
  "summary": "Define enabled search fields, valid operators, and safe default values.",
  "selection": {
    "useWhen": [
      "configure search defaults"
    ],
    "avoidWhen": [
      "column presentation"
    ]
  },
  "relations": [],
  "requires": [],
  "content": {
    "decision": "Which filters should be enabled and initialized?",
    "distinctions": [
      "Filter defaults affect returned records; column defaults affect presentation"
    ],
    "forbidden": [
      "Implicit non-visible query constraints"
    ],
    "guidance": "Keep enabled fields, operators, and supplied defaults explicit and reversible. Prototype changes remain in memory unless the page provides a separately approved persistence flow.",
    "optional": [
      "Default value"
    ],
    "required": [
      "Field key",
      "Enabled state",
      "Valid operator"
    ]
  }
}
